name;price
Элитная коллекция пригласительных открыток;"0"
Художественные журналы с персонализированной обложкой;"0"
Организаторы с персонализированным дизайном и тиснением;"0"
Альбомы для фотографий с тиснением и мягкими листами;"0"
Изготовленные на заказ ежедневники с закладками из ленты;"0"
Персонализированные конверты с сургучными печатями;"0"
Комплекты открыток с тематическими принтами;"0"
Декоративные коробки с узорами из тиснения;"0"
Экологичные сумки-шопперы с ручками из крафт-бумаги;"0"
Оригами-комплекты с пошаговыми инструкциями;"0"
Набор бумажных цветов с реалистичными деталями;"0"
Календари с эстетичными дизайнами и функциональными функциями;"0"
Ежедневники с яркими принтами и водостойкой обложкой;"0"
Блокноты с обложкой из переработанного картона и тонированной бумагой;"0"
Наборы карточек ручной работы с уникальными иллюстрациями;"0"
Настенные панно из бумаги-маше с объемными деталями;"0"
Доски для заметок из переработанной бумаги с ярким дизайном;"0"
Конверты с вырезами и красочными подкладками;"0"
Подарочная упаковка с персонализированными сообщениями и декором;"0"
Наборы для рисования с бумагой высокого качества и инструментами;"0"
Книги-раскраски со сложными узорами и мотивами;"0"
Наборы оригами с разноцветной бумагой и схемами;"0"
Настенные обои с текстурами, имитирующими натуральные материалы;"0"
Оберточная бумага с замысловатыми принтами и фактурами;"0"
Свадебные приглашения с замысловатыми кружевами из бумаги;"0"
Рождественские открытки с тиснением и блестящими элементами;"0"
Наборы для квиллинга с разноцветными полосками бумаги и инструментом;"0"
Абажуры из бумаги с уникальными формами и узорами;"0"
Мебель из картона с прочной и легкой конструкцией;"0"
Дизайнерская бумага для скрапбукинга с различными текстурами и принтами;"0"
Обложки для книг с индивидуальной гравировкой и яркими рисунками;"0"
Скетчбуки с акварельной бумагой и удобной спиралью;"0"
Папки-регистраторы с тиснением и прочной картонной обложкой;"0"
Наборы для рисования с цветными карандашами, фломастерами и бумагой;"0"
Маски из папье-маше с изысканными деталями и рисунками;"0"
Изготовленные на заказ фотоальбомы с хронологическими разделителями;"0"
Свадебные программы с элегантным дизайном и качественной бумагой;"0"
Приглашения на детский праздник с яркими принтами и забавными персонажами;"0"
Карточки с рецептами со стильными рамками и водонепроницаемой подложкой;"0"
Обложки для паспортов с замысловатыми рисунками и защитой от RFID;"0"
Коробочки для подарков с окнами из прозрачной бумаги и лентами;"0"
Декоративные вазы из картона с уникальными формами и текстурами;"0"
Костюмы из папье-маше для фестивалей и театральных представлений;"0"
Органайзеры для ванной с водостойким покрытием и нескользящим дном;"0"
Календари с магнитными держателями и увеличенными полями для заметок;"0"
Подарочные сертификаты с тиснением и персонализированным дизайном;"0"
Обложки для альбомов с тисненым текстом и мягкой набивкой;"0"
Блокноты с прошитыми страницами и гибкой обложкой;"0"
Упаковочная бумага с биоразлагаемым покрытием и яркими принтами;"0"
Визитные карточки с тиснением, ламинированием и выборочной УФ-печатью;"0"
Коробки для хранения с разделителями из картона и магнитными застежками;"0"
Тематические наборы открыток с художественными иллюстрациями;"0"
Комиксы с уникальными сюжетами и персонализированными персонажами;"0"
Книги с выдвижной бумагой с прикрепленными фигурками или предметами;"0"
Поздравительные открытки с музыкальным чипом и настраиваемой мелодией;"0"
Светодиодные фонари из бумаги с вырезанными узорами и мягким светом;"0"
Украшения из папье-маше с яркими цветами и затейливыми формами;"0"
Модели парусных кораблей из бумаги с детальными парусами и корпусом;"0"
Бумажные скульптуры с подвижными частями и реалистичными деталями;"0"
Коврики для занятия йогой из переработанного картона с противоскользящей поверхностью;"0"
Наборы для аппликации с цветной бумагой, ножницами и клеем;"0"
Домики для кукол из картона с мебелью и аксессуарами;"0"
Оригами-гирлянды с разноцветными бумажными фигурами;"0"
Подарочные пакеты с рельефным рисунком и ручками из ленты;"0"
Обложки для электронной книги с индивидуальной гравировкой и магнитными застежками;"0"
Бумажные гирлянды с вырезанными вручную узорами и тканевыми лентами;"0"
Мемуарные книги с персонализированными обложками и расширенными полями;"0"
Игрушечные машины из картона с реалистичными деталями и подвижными колесами;"0"
Наборы для рисования с цветными карандашами, маркерами и бумагой премиум-класса;"0"
Бумажные самолеты с уникальным дизайном и аэродинамической конструкцией;"0"
Бумажные тарелки с персонализированными принтами и экологически чистым покрытием;"0"
Бумажные лампы с вырезанными вручную узорами и теплым рассеянным светом;"0"
Картонные домики для кошек с прорезями и мягкими подушечками;"0"
Доски для рисования с магнитной поверхностью и водонепроницаемой бумагой;"0"
Бумажные зонты с красочными принтами и водоотталкивающей обработкой;"0"
Металлизированная бумага с блестящим покрытием и широким спектром оттенков;"0"
Самоклеющаяся бумага с яркими принтами и легким нанесением;"0"
Дизайнерская бумага с узорами из тиснения, фольги и тиснением;"0"
Бумажные постеры с высококачественными принтами и экологически чистой отделкой;"0"
Упаковочная бумага с биоразлагаемым покрытием и устойчивыми к разрывам рулонами;"0"
Картонные коробки с пользовательскими размерами, внутренними вставками и тиснением;"0"
Самовосстанавливающиеся офисные подложки из картона с нескользящей поверхностью и водостойким покрытием;"0"
Разноцветная бумага для орегами с замысловатыми узорами и повышенной толщиной;"0"
Конверты для прямой почтовой рассылки с глянцевой отделкой, самоклеющимся клапаном и расширенными полями;"0"
Промышленная бумага с высокой прочностью на разрыв, влагостойкостью и устойчивостью к истиранию;"0"
Вощеная бумага с биоразлагаемым покрытием, водостойкостью и термостойкостью;"0"
Бумага для акварели холодного прессования с текстурированной поверхностью и высоким содержанием хлопка;"0"
Пергаментная бумага с жиростойким покрытием, устойчивостью к высоким температурам и возможностью многократного использования;"0"
Пекарская бумага с антипригарной поверхностью, термостойкостью и влагостойкостью;"0"
Бумага для рисования с гладкой поверхностью, высокой плотностью и превосходной белизной;"0"
Блокноты для заметок с проклеенными страницами, твердой обложкой и эластичной застежкой;"0"
Папка с кольцами с прозрачными карманами, разделителями и застежкой-молнией;"0"
Портфель из картона с прочным корпусом, удобными отделениями и мягкой ручкой;"0"
Кипа бумаги формата A4 с высокой белизной;"0"